{
  "$schema": "execution-policy-effective-view.schema.json",
  "schema_version": "webenvoy.execution-policy-effective-view.v0",
  "skill_ref": "lode://site-capability/xiaohongshu/search-notes@0.1.0",
  "owner_declaration_ref": "lode://site-capability/xiaohongshu/search-notes@0.1.0#action_declaration",
  "owner_declaration_version": "0.1.0",
  "thread_ref": "thread_11111111111111111111111111111111",
  "turn_sequence": 2,
  "actions": [
    {
      "action_id": "xhs_search_notes",
      "category": "read",
      "target_scope": {
        "site_slug": "xiaohongshu",
        "target_types": ["search_results_page"],
        "supported_origins": ["https://www.xiaohongshu.com"]
      },
      "risk_marker": null,
      "effective_policy": {
        "mode": "deny",
        "source": "thread_revision",
        "source_ref": "execution-policy:thread_revision:265e3eaca43c5789c14decbba1649ad3",
        "source_version": "1"
      }
    },
    {
      "action_id": "xhs_delete_saved_search",
      "category": "destructive",
      "target_scope": {
        "site_slug": "xiaohongshu",
        "target_types": ["saved_search"],
        "supported_origins": ["https://www.xiaohongshu.com"]
      },
      "risk_marker": "destructive",
      "effective_policy": null,
      "stop_reason": "policy_unavailable"
    }
  ],
  "consumer_boundary": "Business action modes and versioned owner refs only; credentials, browser storage, raw evidence, page content, and App drafts are excluded."
}
